{
  "event_links": [
    {
      "event_id": "EVENT_P2_008_MAGE_TOWER_MASSACRE",
      "link_basis": [
        "participant_ref"
      ],
      "participant_roles": [
        "actor"
      ],
      "profile_canon_layer": "original_campaign",
      "revelation_ids": [],
      "source_canon_layer": "original_campaign",
      "source_story_temporal_scope": "original_campaign",
      "story_order_end": null,
      "story_order_start": "P2-008"
    }
  ],
  "notes": "R2B mechanical exact-reference index only; no R2C semantic migration.",
  "phase": "3D-R2B",
  "profile_candidate_source": "work/phase3d_recall/repaired_candidates/NPC_WURAI.json",
  "profile_id": "NPC_WURAI",
  "schema_version": "R2B-1"
}
