{
  "event_links": [
    {
      "event_id": "EVENT_P1_007_UKON_BROTHERHOOD_CONTACT",
      "link_basis": [
        "participant_ref",
        "revelation_subject"
      ],
      "participant_roles": [
        "actor"
      ],
      "profile_canon_layer": "original_campaign",
      "revelation_ids": [
        "REVEAL_P1_UKON_ACTIVE_COOPERATION_001"
      ],
      "source_canon_layer": "original_campaign",
      "source_story_temporal_scope": "original_campaign",
      "story_order_end": null,
      "story_order_start": "P1-007"
    },
    {
      "event_id": "EVENT_P1_009_BORDER_TRUTH_AND_PURSUIT_MISSION",
      "link_basis": [
        "participant_ref"
      ],
      "participant_roles": [
        "commander"
      ],
      "profile_canon_layer": "original_campaign",
      "revelation_ids": [],
      "source_canon_layer": "original_campaign",
      "source_story_temporal_scope": "original_campaign",
      "story_order_end": null,
      "story_order_start": "P1-009"
    },
    {
      "event_id": "EVENT_P1_014_DAKAS_PLOT_EXPOSED",
      "link_basis": [
        "participant_ref"
      ],
      "participant_roles": [
        "commander"
      ],
      "profile_canon_layer": "original_campaign",
      "revelation_ids": [],
      "source_canon_layer": "original_campaign",
      "source_story_temporal_scope": "original_campaign",
      "story_order_end": null,
      "story_order_start": "P1-014"
    },
    {
      "event_id": "EVENT_P1_015_UKON_BATTLE_YOUYOU_RESCUE",
      "link_basis": [
        "participant_ref"
      ],
      "participant_roles": [
        "actor"
      ],
      "profile_canon_layer": "original_campaign",
      "revelation_ids": [],
      "source_canon_layer": "original_campaign",
      "source_story_temporal_scope": "original_campaign",
      "story_order_end": null,
      "story_order_start": "P1-015"
    },
    {
      "event_id": "EVENT_P1_019_XUE_REBUKE_AND_TRANSFER_DECISION",
      "link_basis": [
        "participant_ref"
      ],
      "participant_roles": [
        "participant"
      ],
      "profile_canon_layer": "original_campaign",
      "revelation_ids": [],
      "source_canon_layer": "original_campaign",
      "source_story_temporal_scope": "original_campaign",
      "story_order_end": null,
      "story_order_start": "P1-019"
    }
  ],
  "notes": "R2B mechanical exact-reference index only; no R2C semantic migration.",
  "phase": "3D-R2B",
  "profile_candidate_source": "work/phase3d_recall/repaired_candidates/NPC_OSHUTORU.json",
  "profile_id": "NPC_OSHUTORU",
  "schema_version": "R2B-1"
}
