{
  "event_links": [
    {
      "event_id": "EVENT_P2_018_YANG_AND_DRAGON_BANQUET_ENTRY",
      "link_basis": [
        "participant_ref"
      ],
      "participant_roles": [
        "host"
      ],
      "profile_canon_layer": "original_campaign",
      "revelation_ids": [],
      "source_canon_layer": "original_campaign",
      "source_story_temporal_scope": "original_campaign",
      "story_order_end": null,
      "story_order_start": "P2-018"
    },
    {
      "event_id": "EVENT_P2_022_DEATHWING_HISTORY_TESTIMONY",
      "link_basis": [
        "participant_ref"
      ],
      "participant_roles": [
        "participant"
      ],
      "profile_canon_layer": "original_campaign",
      "revelation_ids": [],
      "source_canon_layer": "original_campaign",
      "source_story_temporal_scope": "original_campaign",
      "story_order_end": null,
      "story_order_start": "P2-022"
    },
    {
      "event_id": "EVENT_P3_006_CASSANDRA_FUTURES_AND_TRADE",
      "link_basis": [
        "participant_ref"
      ],
      "participant_roles": [
        "injured"
      ],
      "profile_canon_layer": "original_campaign",
      "revelation_ids": [],
      "source_canon_layer": "original_campaign",
      "source_story_temporal_scope": "original_campaign",
      "story_order_end": null,
      "story_order_start": "P3-006"
    },
    {
      "event_id": "EVENT_P3_010_WHITE_MAGE_EXIT_AND_THEORY",
      "link_basis": [
        "participant_ref"
      ],
      "participant_roles": [
        "restrained"
      ],
      "profile_canon_layer": "original_campaign",
      "revelation_ids": [],
      "source_canon_layer": "original_campaign",
      "source_story_temporal_scope": "original_campaign",
      "story_order_end": null,
      "story_order_start": "P3-010"
    },
    {
      "event_id": "EVENT_TRANSITION_D1_COLLAPSE_EVACUATION",
      "link_basis": [
        "participant_ref"
      ],
      "participant_roles": [
        "evacuated"
      ],
      "profile_canon_layer": "transition",
      "revelation_ids": [],
      "source_canon_layer": "transition_canon",
      "source_story_temporal_scope": "transition_canon",
      "story_order_end": null,
      "story_order_start": "TRANSITION-D1"
    }
  ],
  "notes": "R2B mechanical exact-reference index only; no R2C semantic migration.",
  "phase": "3D-R2B",
  "profile_candidate_source": "work/phase3d_recall/repaired_candidates/NPC_HONDA_KAI_FERGUS.json",
  "profile_id": "NPC_HONDA_KAI_FERGUS",
  "schema_version": "R2B-1"
}
