{
  "event_links": [
    {
      "event_id": "EVENT_P2_004_BAIT_PLAN_PREPARATION",
      "link_basis": [
        "participant_ref"
      ],
      "participant_roles": [
        "participant"
      ],
      "profile_canon_layer": "original_campaign",
      "revelation_ids": [],
      "source_canon_layer": "original_campaign",
      "source_story_temporal_scope": "original_campaign",
      "story_order_end": null,
      "story_order_start": "P2-004"
    },
    {
      "event_id": "EVENT_P2_005_GREMLIN_MANSION_BATTLE",
      "link_basis": [
        "participant_ref"
      ],
      "participant_roles": [
        "combatant"
      ],
      "profile_canon_layer": "original_campaign",
      "revelation_ids": [],
      "source_canon_layer": "original_campaign",
      "source_story_temporal_scope": "original_campaign",
      "story_order_end": null,
      "story_order_start": "P2-005"
    }
  ],
  "notes": "R2B mechanical exact-reference index only; no R2C semantic migration.",
  "phase": "3D-R2B",
  "profile_candidate_source": "work/phase3d_recall/repaired_candidates/NPC_NOSURI.json",
  "profile_id": "NPC_NOSURI",
  "schema_version": "R2B-1"
}
