{
  "event_links": [
    {
      "event_id": "EVENT_P1_022_EXECUTION_TAIL_HOOK",
      "link_basis": [
        "participant_ref"
      ],
      "participant_roles": [
        "absent_but_affected"
      ],
      "profile_canon_layer": "original_campaign",
      "revelation_ids": [],
      "source_canon_layer": "original_campaign",
      "source_story_temporal_scope": "original_campaign",
      "story_order_end": null,
      "story_order_start": "P1-022"
    },
    {
      "event_id": "EVENT_P2_023_WHITE_MAGICIAN_ARMORY_CONFRONTATION",
      "link_basis": [
        "participant_ref"
      ],
      "participant_roles": [
        "opponent"
      ],
      "profile_canon_layer": "original_campaign",
      "revelation_ids": [],
      "source_canon_layer": "original_campaign",
      "source_story_temporal_scope": "original_campaign",
      "story_order_end": null,
      "story_order_start": "P2-023"
    },
    {
      "event_id": "EVENT_P3_002_SANCTUARY_ENTRY",
      "link_basis": [
        "participant_ref"
      ],
      "participant_roles": [
        "opposing_force"
      ],
      "profile_canon_layer": "original_campaign",
      "revelation_ids": [],
      "source_canon_layer": "original_campaign",
      "source_story_temporal_scope": "original_campaign",
      "story_order_end": null,
      "story_order_start": "P3-002"
    },
    {
      "event_id": "EVENT_P3_005_XIERLUN_FRONT_AND_WHITE_MAGE_PROPOSAL",
      "link_basis": [
        "participant_ref",
        "revelation_subject"
      ],
      "participant_roles": [
        "negotiator"
      ],
      "profile_canon_layer": "original_campaign",
      "revelation_ids": [
        "REVEAL_P3_WHITE_MAGE_CASSANDRA_CLAIM_001"
      ],
      "source_canon_layer": "original_campaign",
      "source_story_temporal_scope": "original_campaign",
      "story_order_end": null,
      "story_order_start": "P3-005"
    },
    {
      "event_id": "EVENT_P3_006_CASSANDRA_FUTURES_AND_TRADE",
      "link_basis": [
        "participant_ref"
      ],
      "participant_roles": [
        "absent_but_affected"
      ],
      "profile_canon_layer": "original_campaign",
      "revelation_ids": [],
      "source_canon_layer": "original_campaign",
      "source_story_temporal_scope": "original_campaign",
      "story_order_end": null,
      "story_order_start": "P3-006"
    },
    {
      "event_id": "EVENT_P3_010_WHITE_MAGE_EXIT_AND_THEORY",
      "link_basis": [
        "participant_ref",
        "revelation_subject"
      ],
      "participant_roles": [
        "actor_and_theorist"
      ],
      "profile_canon_layer": "original_campaign",
      "revelation_ids": [
        "REVEAL_P3_WHITE_MAGE_FATE_THEORY_001"
      ],
      "source_canon_layer": "original_campaign",
      "source_story_temporal_scope": "original_campaign",
      "story_order_end": null,
      "story_order_start": "P3-010"
    },
    {
      "event_id": "EVENT_TRANSITION_D0_BOUNDARY",
      "link_basis": [
        "participant_ref"
      ],
      "participant_roles": [
        "actor"
      ],
      "profile_canon_layer": "transition",
      "revelation_ids": [],
      "source_canon_layer": "transition_canon",
      "source_story_temporal_scope": "transition_canon",
      "story_order_end": null,
      "story_order_start": "TRANSITION-D0"
    },
    {
      "event_id": "EVENT_TRANSITION_D1_COLLAPSE_EVACUATION",
      "link_basis": [
        "participant_ref"
      ],
      "participant_roles": [
        "takes_gem"
      ],
      "profile_canon_layer": "transition",
      "revelation_ids": [],
      "source_canon_layer": "transition_canon",
      "source_story_temporal_scope": "transition_canon",
      "story_order_end": null,
      "story_order_start": "TRANSITION-D1"
    }
  ],
  "notes": "R2B mechanical exact-reference index only; no R2C semantic migration.",
  "phase": "3D-R2B",
  "profile_candidate_source": "work/phase3d_recall/repaired_candidates/NPC_WHITE_MAGICIAN.json",
  "profile_id": "NPC_WHITE_MAGICIAN",
  "schema_version": "R2B-1"
}
